<?xml version="1.0" encoding="UTF-8"?>
<root xmlns:cda="urn:hl7-org:v3" xmlns:proxy="com:spirit:SpiritProxy"
      xmlns:xsi="http://www.w3.org/2001/XMLSchema-instance"
      columnDelimiterCharacter="," insertNewlinesAfterSqlColumns="false" insertNewlinesAfterSqlStatements="true"
      quoteCharacterForValues="&apos;" statementDelimiterCharacter=";"
      xsi:noNamespaceSchemaLocation="../schema/config.xsd">

    <mainTable tableName="eTransaction">
        <extractionRule matchXPath="/proxy:Transaction/proxy:TransactionInfo">
            <mapping targetColumn="Direction" sourceXPath="@Direction"/>
            <mapping targetColumn="HomeISO" sourceXPath="@HomeISO"/>
            <mapping targetColumn="HomeNCP_OID" sourceXPath="@HomeNCP_OID"/>
            <mapping targetColumn="HomeHCID" sourceXPath="@HomeHCID"/>
            <mapping targetColumn="HomeHost" sourceXPath="@HomeHost"/>
            <mapping targetColumn="HomeAddress" sourceXPath="@HomeAddress"/>
            <mapping targetColumn="SndISO" sourceXPath="@SndISO"/>
            <mapping targetColumn="SndNCP_OID" sourceXPath="@SndNCP_OID"/>
            <mapping targetColumn="SndHCID" sourceXPath="@SndHCID"/>
            <mapping targetColumn="SndAddress" sourceXPath="@SndAddress"/>
            <mapping targetColumn="SndHost" sourceXPath="@SndHost"/>
            <mapping targetColumn="SndMsgID" sourceXPath="@SndMsgID"/>
            <mapping targetColumn="ReceivingISO" sourceXPath="@ReceivingISO"/>
            <mapping targetColumn="ReceivingNCP_OID" sourceXPath="@ReceivingNCP_OID"/>
            <mapping targetColumn="ReceivingHost" sourceXPath="@ReceivingHost"/>
            <mapping targetColumn="ReceivingAddr" sourceXPath="@ReceivingAddr"/>
            <mapping targetColumn="ReceivingMsgID" sourceXPath="@ReceivingMsgID"/>
            <mapping targetColumn="TransactionCounter" sourceXPath="@TransactionCounter"/>
            <mapping targetColumn="HumanRequestor" sourceXPath="@HumanRequestor"/>
            <mapping targetColumn="UserId" sourceXPath="@UserId"/>
            <mapping targetColumn="POC" sourceXPath="@POC"/>
            <mapping targetColumn="POC_ID" sourceXPath="@POC_ID"/>
            <mapping targetColumn="AuthenticationLevel" sourceXPath="@AuthenticationLevel"/>
            <mapping targetColumn="RequestAction" sourceXPath="@RequestAction"/>
            <mapping targetColumn="ResponseAction" sourceXPath="@ResponseAction"/>
            <mapping targetColumn="ServiceType" sourceXPath="@ServiceType"/>
            <mapping targetColumn="ServiceName" sourceXPath="@ServiceName"/>
            <mapping targetColumn="StartTime" sourceXPath="@StartTime"/>
            <mapping targetColumn="EndTime" sourceXPath="@EndTime"/>
            <mapping targetColumn="Duration" sourceXPath="@Duration"/>
        </extractionRule>
    </mainTable>

    <childTable tableName="eTransactionData">
        <group label="CDA Info">
            <content>
                <extractionRule
                        matchXPath="/proxy:Transaction/cda:ClinicalDocument/cda:templateId[starts-with(@root,'1.3.6.1.4.1.12559')]">
                    <mapping targetColumn="DataType" sourceXPath="'cda:ClinicalDocument/cda:templateId'"/>
                    <mapping targetColumn="DataTypeName" sourceXPath="'Service OID'"/>
                    <mapping targetColumn="DataValue" sourceXPath="@root"/>
                    <mapping targetColumn="ValueDisplay"
                             sourceXPath="if (@root = '1.3.6.1.4.1.12559.11.10.1.3.1.1.3') then 'Patient Summary' else if (@root = '1.3.6.1.4.1.12559.11.10.1.3.1.1.2') then 'eDispensation' else if (@root = '1.3.6.1.4.1.12559.11.10.1.3.1.1.1') then 'ePrescription' else if (@root = '1.3.6.1.4.1.12559.11.10.1.3.1.1.7') then 'Patient Summary PDF embedded' else if (@root = '1.3.6.1.4.1.12559.11.10.1.3.1.1.6') then 'ePrescription PDF embedded' else 'unknown'"/>
                </extractionRule>
            </content>
        </group>
    </childTable>
</root>
